{
  "schemaVersion": "1.0",
  "source": {
    "id": "com.example.tools",
    "name": "Example Community Source",
    "operator": "Example Community"
  },
  "repository": {
    "profile": "tuf-v1",
    "metadataBaseUrl": "https://tools.example.com/metadata/",
    "targetsBaseUrl": "https://tools.example.com/targets/",
    "rootUrl": "https://tools.example.com/metadata/1.root.json",
    "rootSha256": "9f86d081884c7d659a2feaa0c55ad015a3bf4f1b2b0b822cd15d6c15b0f00a08"
  },
  "capabilities": {
    "catalog": true,
    "staticMirror": true
  }
}
